id,价格,评价,评价日期,票务类型,评论,
汤圆露馅儿啦,425,5,2021.11.20,华山风景名胜区（徒步登山）门票成人票,进山那天天气不佳，但还是如愿看到了日落和日出 ，我和姐姐爬上去用了挺久时间的，因为我俩走得慢哈哈哈哈，其实是不需要带零食的，我们俩背了可多零食，基本都喂猫了，如果去玩想喂猫可以带点猫粮就好，没必要带食物，因为一路上都有卖，稍微贵点但没有网传那么离谱，爬累了吃完泡面就很知足了。很喜欢爬山。待得算久所以所有峰都爬过了，我们住在北峰。早上五点起床去了东峰看日出，北峰住宿还挺划算的（可能因为没什么游客）我跟姐姐俩个人150元。我爱祖国的大好山河！,
Nozomi_via,425,5,2021.11.21,(地推)华山风景名胜区单程北峰索道票,从西安到华山还算方便。最方便省时的，首推高铁。西安北--华山北二等座59.5元。从西安北站出发，到达华山北的火车，每天运行好几列，华山北站出来后，有公交1路（免费）直接开到华山脚下的游客中心，全程耗时大概在20分钟左右。如果不选择公交，也可以拼车，一车20元（不打表）其实从华山北站出来到华山游客中心，全程5公里左右吧！爬华山真的很累，尤其是一天之内要走完五峰。我是西峰索道上，依次游览西峰（看日落最佳）--南峰（长空栈道）--东峰（鹞子翻身、看日出最佳）--中峰--北峰，再有北峰索道下。全程控制时间在6-7小时。第二天，腿不是自己的了~,
小李同志3321,425,4,2021.10.16,(地推）华山风景名胜区票+西峰摆渡车票（上行）+关帝庙景区票成人票, ,
A青盐,425,5,2021.10.25,华山风景名胜区（徒步登山）门票成人票,打卡华山（10月）夜爬说点简单的①带好保温杯，山上有商店，晚上的话偶尔会有还开着的，热水5元一次，有卖吃的（会贵点）②如果可以带件雨衣，有可能会下雨③登山杖个人认为没用，一路都有锁链的，可以抓着上，晚上也一直有灯，不用带手电筒之类的④带酒的话小瓶劲酒2瓶最好，喝不醉还驱寒（吃药别喝酒）⑤从门口上山跟着路线一直到北峰，9-10点出发3.4点的样子稳稳到，爬山别急，然后北峰离中西东南峰有些距离，大约到西峰需要2-3小时⑥看日出日落不推荐中峰，因为有棵树挡着，实在爬不动可以到仙掌崖看，那里视野还不错⑦山上有旅舍，环境以及外型还不错⑧山上有很多猫，想喂猫的话多带点吃的⑨手套帽子必备的，越往上越冷的，衣服拉链一定要拉！要不肚子冻硬你都没感觉的⑩从西安走的话坐高铁就可以，票价20-30，下午6:30以后没有大巴通华山，从渭南坐到华山至少150起步，如果选择晚上出发高铁直坐到华山北站，再打车要便宜点祝各位在华山能找到自己想要的，注意安全,
守己哈哈哈18,425,5,2021.11.16,华山风景名胜区（徒步登山）门票成人票,之前去过两次华山，但是当时天气比较好，这次是冬天去的 ，难度确实大了很多很多，本来想着封顶西风，结果到北风就没去了，越往上越滑，而且结冰很厉害，买了防滑链，但是也滑，人不多，山顶的住宿特别贵，心痛，我们时间没选好，太难受了。,
匿名用户,425,5,2021.10.18,华山风景名胜区（徒步登山）门票成人票,建议一定要从玉泉院，徒步登山，大概用了9个半小时走完北中东南西峰，有个四川的姐姐一块同行，身体素质超棒，一路走下来，忘记留个联系方式了，看见了记得@我，山东小伙，哈哈，腿都抽筋了，玩了一个鹞子翻身，挺险。人太多，很遗憾没玩长空栈道，最美的旅途永远在路上。,
rDl767186115,425,5,2021.11.23,华山风景名胜区单程北峰索道票, ,
我爱_milk,425,5,2021.10.11,(地推）华山风景名胜区票+西峰摆渡车票（上行）+关帝庙景区票成人票,华山唐:郑谷 峭仞耸巍巍，晴岚染近畿。孤高不可状，图写尽应非。绝顶神仙会，半空鸾鹤归。云台分远霭，树谷隐斜晖。坠石连村响，狂雷发庙威。气中寒渭阔，影外白楼微。云对莲花落，泉横露掌飞。乳悬危磴滑，樵彻上方稀。淡泊生真趣，逍遥息世机。野花明涧路，春藓涩松围。远洞时闻磬，群僧昼掩扉。他年洗尘骨，香火愿相依。,
EnM302893254,425,5,2021.11.17,华山风景名胜区（徒步登山）门票成人票,风景不错。有挑战性。徒步上山，确实有点累。人生当中一定要去华山走一趟。我们是爬了北峰，最高峰在南峰，西峰的缆车是最好的。最险的地方在，千尺瞳，白尺侠，我们去的时间是11月份，相对而言比较冷一些。山上还有雪，还有天梯是没开的。,
逆向工程研究,425,5,2021.11.20,华山风景名胜区（徒步登山）门票成人票,风景不孬，西峰索道太刺激了。作为山东人泰山都没爬过，先把华山爬了，征服五岳的第一个小目标达成了。,
守己哈哈哈18,425,5,2021.11.16,华山风景名胜区（徒步登山）门票成人票,中午开始爬的，到了晚上才到北风订，我们住了一晚上，价格很贵，真的难受，建议不要大晚上爬，太危险了，山上很滑很滑，里面吃的很多店都关门了，建议自己多带一点，山上风特别大，把防滑链一定弄上，我买的五十多块，价格还是挺贵的。,
行者o疆a,425,4,2021.09.18,华山风景名胜区（徒步登山）门票成人票, ,
aUC290811505,425,4,2021.11.25,华山风景名胜区语音导览票（不含门票）,登山真的超级无敌巨累， 但是登顶之后看到的风景简直了。付出也是值得的。玩了很多项目一天怕是都不够，后悔没有晚上怕，不然可以看日出，建议带上厚衣服，山顶真的超级无敌巨冷，冷的我直哆嗦。还有一些我不敢玩的项目,
虎啸龙吟Cc,425,5,2021.11.26,华山风景名胜区（徒步登山）门票成人票,体验感满分，全程徒步，东南西北中五个峰。上午八点上山，下午五点三十到达玉泉院山底。,
JBu634749467,425,5,2021.11.08,（经典玩法不走回头路）华山门票+单程西峰索道票+单程北峰索道票+单程北峰索道专线巴士票+单程西峰索道专线巴士票,「华山西峰」「华山北峰」「西峰太华索道」「日月岩」华山真的是去过一次还想去第二次的地方，坐在索道上看着山下，特别壮观。不是专业登山者，上山或者下山，一定要体验一次，一是省力，二是体验一下。山顶景色很美，云雾缭绕，仙气飘飘～,
nrc149428233,425,4,2021.09.16,华山风景名胜区西峰单程索道票军人/老人/残疾人票,索道很长，用铁塔分了好几段，每过一个铁塔就好像加速了一下，恐高的不要尝试。但你不坐索道还下不来，没有下山的路，整个华山东西南北中峰，只有北峰有个“自古华山一条路”，爬上北峰得4个小时，，其他4个峰转一圈又得4、5个小时，再从北峰走下山，好像不太现实，所以还得坐索道上下山，建议西上北下，西峰高于北峰，北峰爬到西峰太累了。个人认为最佳路线：乘坐景区里面的大巴车上西峰，40分钟40元钱；西峰索道20分钟140元钱；西―南―东―中―北峰步行，5个小时；北峰索道10分钟80元钱；景区里面的大巴车下山，20分钟20元钱。美好的一天结束！,
柒捌玖10,425,3,2021.09.23,华山风景名胜区票门票（徒步登山）,天气不好，没有看到日出，而且很多玩的都没开放，索道等都是关的，上去什么都没看看，光吹风了。         晚上9点爬的，正常3个小时就能爬上去，没难度，去的太早了，上面歇了会，一人50。          建议一人带两瓶水，带些面包，辣条都行，别带太干的东西，也不用带太多，山上确实贵，但也能接受。         还有就是鞋子要穿舒服，衣服要穿厚，,
oFy763560934,425,1,2021.07.29,华山景区往返直通车不限人群票（周内）, ,
OHx550244845,425,5,2021.10.02,华山风景名胜区（徒步登山）门票成人票,徒步上山，浏览了所有峰顶，用时12.35小时，其中鹞子翻身排队等了2小时，然后徒步下山，累并快乐着，   遗憾的是长空栈道要等3个小时只能留着下次二刷华山了     体力不好的下山一定要做索道，不说了我去揉腿了,
吃货困困崽,425,4,2021.11.14,华山风景名胜区（徒步登山）门票成人票,挺好的就是山上物价太贵啦！！风景蛮不错的！,
格来梅朵215,425,4,2021.10.23,华山风景名胜区（徒步登山）门票成人票,上下都爬的山，爬了九个小时，风景挺美的，山上东西挺贵的，最好自己带上,
h弋,425,5,2021.09.16,华山风景名胜区（徒步登山）门票成人票,二零二一年九月十日晚上正好星期五，晚上学生很多一起徒步爬山很不错。根据本人体验，如果有相机，晚上八点就出发，半山腰就可以看到星空银河，不过银河得用相机长曝光才能拍出来，路上走走停停基本会在早上四点到达东峰。徒步上山不要走太快，因为拍照是关键，所谓的东峰看日出没有多大意义，晚上的星空才是关键，手机也可以拍，只要有三脚架,
匿名用户,425,1,2021.09.13,华山风景名胜区单程北峰索道票,文字很长，强烈提示！要买票一定要通过正规渠道买，千万不要通过第三方买比如司机、自称内部工作人员的人，不然被坑了还没办法退，华山的管理真的是很垃圾，出租车司机和内部人员相互勾结，给你推荐让你买门票索道票，说他兄弟在景区工作，从他那拿票自己能挣五块，结果给你给的是团体票，团体票实际卖126元一张（后来找他们退票费时候他们说的），但是票上写的是140元，他还是会140收你的钱，我真不知道他们一天能黑游客多少钱，刚好那天我碰到大风天西峰索道不开，拿着票去退，工作人员推来推去说不是他们那出的票，第一句就是问在谁那买的（他们明知道他们内部人员在倒卖票），让你去找这个窗口那个窗口，还给我来句：我是在帮你，帮我？你们自己出的票，我找你们退竟然`着脸说是在给我帮忙？白跑冤枉路还不给你退钱，我说我要投诉，这票明明盖着你们的章子难道是我假造的？工作人员直接来一句每天像你一样投诉的人也很多……明明知道自己内部管理有问题还说的这么理直气壮，非得让我投诉他们才松口给我退，但是只给我按团体票126元退，我不同意，到处找投诉电话，他们才又找到另一个姓柳的人把余款给我退了。希望这个评价能上去，附上投诉电话。,
匿名用户,425,5,2021.10.24,华山风景名胜区票+西峰摆渡车票（上行）+关帝庙景区票成人票, ,
咔吃咔吃mmm,425,5,2021.10.31,华山风景名胜区西峰单程索道票成人票,风景独好，站在山顶真是太美了，我们去的时候刮了大风，长空栈道都不能玩，比较遗憾，风景非常美，也非常险，如果爬山从北边上是极好的，如果是爬山菜鸡，那么建议坐缆车，然后从北边下山，就是坐缆车需要排很久的队，主要是节假日，哪个景区人都多。总之，非常棒了，建议大家去体验,
匿名用户,425,5,2021.10.07,华山风景名胜区（徒步登山）门票成人票,强烈推荐！国庆夜爬上山，看到了日出，运气无敌好，后面几天就下雨了，风景炒鸡好，真正一步一步爬上去才知道山有多么巍峨,
exw725124877,425,5,2021.11.16,华山风景名胜区单程北峰索道票,做的惊心动魄，还好运行非常平稳，非常值得,
mVD830672747,425,5,2021.11.04,华山风景名胜区（徒步登山）门票成人票,一个字，来！,
懒小猫的快乐,425,3,2021.08.16,华山风景名胜区门票+往返北峰索道票+往返北峰索道专线巴士, ,
马驹麻麻,425,5,2021.07.07,华山风景名胜区门票成人票,来西安跑马，想着必须来华山一次，本想夜爬看日出，想想晚上啥也看不到还是白天来，买了早上最早的火车，下车打车直奔玉泉院，带了三瓶水和面包饼干鸡蛋，早就听说华山是奇险天下第一山果然名不虚传，华山是真险也真陡，完全不同于黄山。爬过华山之后我是相信当年岳灵珊对令狐冲的感情绝对是真爱，天天爬山来给他送饭简直太南了。腿也是真的酸爽，人生也许总得有些遗憾，上山时间太久怕赶不上高铁就没去长空栈道。但是我觉得这也是一种缺憾美，假若来到西安未去华山才真的遗憾。感谢这次华山之行，有点恐高的我一次次克服自己对自然的恐惧，在百尺崖老君犁沟那边真的快要累到崩溃，腿已经不是自己的了，本以为自己体力尚可没想到还是心率一度飙升到170，真是手脚并用，阶梯太窄了，我是37码的鞋只能容纳三分之一，一点也不敢往后看，害怕随时会掉下去。可是沿途看到还有老年人来爬山又给自己鼓劲要到山顶，终于经历6小时到了西峰莲花峰，俯视群山，顿时一览群山小，那天的云也是我见过最美的云，又一次战胜了自己很有成就感。人生苦短，有花堪折直须折，莫待无花空折枝。所以华山，这辈子一定要去一次。,
KTN492070288,425,5,2021.09.23,华山风景名胜区（徒步登山）门票成人票,第一次来华山就体验夜徒，晚上8点上山凌晨2点到的东峰顶。路上还遇到小伙伴，一起爬。没看天气预报大晚上下雨了，5个人就挤在一个帐篷里面，7点没有日出就直接从西峰索道下山了，果然最美西峰，雨天路滑就没去南峰，还是有点遗憾，有机会会再来一次，奥利给,
小圆儿law,425,3,2021.11.05,华山风景名胜区（徒步登山）门票成人票,服务还可以，市内公交免费到景区（虽然门票能赚回来吧hhh），一定记得带手套，到时候可真的是手脚并用，最好再买一顶帽子，我们还买了登山杖，按照当地人家的推荐路线，不错。顺便说一句，还吃了当地的肉夹馍，很正宗的，真不戳,
WXf393645335,425,3,2021.10.20,华山风景名胜区西峰索道单程票,当天下点下雨 有点雾霾 山顶风景不错 可以去玩一玩,
匿名用户,425,3,2021.09.29,华山风景名胜区西峰索道单程票,五岳华山险为首，早就想去一趟华山，今次终于成行，遂了心愿。美景不胜收，果然独具一格，使人留恋忘返！,
匿名用户,425,2,2021.10.08,华山风景名胜区（徒步登山）门票成人票,爬山的感觉还不错  我是2号去的 重要提示山顶水比较贵。在山脚下卖比较好   长空栈道没有开放没有提示去不成。这个比较不满意客服电话打不通。！！,
朝夕SaMa,425,4,2021.09.21,（地推）华山风景名胜区票+北峰摆渡车票（上行）+关帝庙景区票成人票,夜里下山有路灯坏了看不清台阶，旁边悬崖- -下山腿疼三天，山上面烤肠牛丸好难吃- -尖叫脉动18一瓶。。。,
wqJ707647945,425,5,2021.10.26,华山风景名胜区票门票（徒步登山）,风景雄伟，是个值得去的好地方。,
匿名用户,425,3,2021.10.06,华山风景名胜区（徒步登山）门票成人票, ,
树1988,425,4,2021.09.03,华山风景名胜区（徒步登山）门票成人票,我喜欢旅游，华山真的值得推荐！我是从北峰开始爬，爬了11个小时终于爬到东峰，为了看日出也是拼了，可惜天公不作美没有看到日出，但沿途的风景还是很不错的，值得来一次爬山之旅！！就是爬完整个人都散架了！！！！,
oZm911856675,425,5,2021.11.03,华山风景名胜区（徒步登山）门票成人票,好很好很美风景,
柴柴chaichail,425,5,2021.08.27,华山风景名胜区（徒步登山）门票成人票,华山以险闻名天下，这次爬山果真是亲身体验到了它的险，中途有几段路甚至手脚并用才能上去，惊险又刺激，作为爬山新手上山用了七个小时，差点没虚脱，所以下山坐的索道，北上西下，不愧为好路线，坐索道全程也是一种享受，15分钟的下山时间与上山时间形成鲜明对比，但华山景色无余尽收眼底，让眼睛享受好一番美景，两个字，舒服！有机会还要再去。,
我是小仙女儿c,425,3,2021.12.02,华山风景名胜区西峰单程索道票成人票,还不错 只是我们去的那一天天气不太好 没有看见日出,
ww1246802,425,5,2021.11.30,（经典玩法不走回头路）华山门票+单程西峰索道票+单程北峰索道票+单程北峰索道专线巴士票+单程西峰索道专线巴士票,玩得很开心的一次旅游。景区感觉很不错。有机会再去,
乱世小熊猫,425,5,2021.10.22,华山风景名胜区（徒步登山）门票成人票,风景优美，体验很好，太好玩了。还想去,
EXV182958025,425,3,2021.12.01,华山(玉泉院西山门徒步登山)学生票,挺好的 路途近  价格优惠交通便利  好好好好,
C型人生。,425,5,2021.12.01,（地推）华山风景名胜区票+北峰摆渡车票（上行）+关帝庙景区票成人票,玩的很开心很开心，就是腿很累,
x饿龙咆哮x,425,4,2021.09.06,华山风景名胜区（徒步登山）门票成人票,先说缺点 从玉泉院上山去的那一段路一股臭味 直接打破你对华山的所有美好幻想 优点  山上风景真的很美 真的很险峻 忠告  恐高的没必要来这虐自己 还有就是不要夜爬 日出真比不上沿途爬上来看见的风景,
Mr.黯然,425,3,2021.07.25,华山风景名胜区（徒步登山）门票成人票,进大门要扫健康码，早上七点15开始爬山，到达北峰顶花了三个小时，坐索道的话，可以省去这三个小时，然后剩下的就是人特别多，走到哪都要排队，中途在休息，到达西峰的时候，已经下午两点多了，慢慢的开始下山，再回到玉泉院的时候已经快六点了，逛整个华山，全程步行走了，大概五万步，有多累就不说了，建议穿速干衣，纯棉的就不要穿了，我看有些人从上山一直到下山，衣服都没干过，那多难受，到山顶的时候要做好防晒，其余的地方还是蛮凉快的，手套一定要买，背包里不要装太多食物，山上有卖的，只是比较贵而已，越往高处走，水资源越匮乏，卫生间连水都没有,
匿名用户,425,5,2021.11.23,（地推）华山风景名胜区票+北峰摆渡车票（上行）+关帝庙景区票成人票,和老婆一起去爬山，哈哈哈，还好有索道，不然真的累的下不来了,
XUl276923910,425,3,2021.07.27,华山风景名胜区（徒步登山）门票成人票,我是从北边的玉泉院步行上去的，从西边坐索道下，接着坐了30元的滑道，有点好玩。因为是上山，所以爬山比下山好点，我走了大概5个半小时，只有东峰没上去了，其它西、南、北都去了，走路是越走越新鲜，估计是养气足，感觉不是很累，步行能走到“千尺幢”，那里是90度笔直的，楼梯很窄5至10厘米左右。，爬上去不敢看下面，而且很长很高，我只敢看前面一个台阶，生怕停下来不敢走，一股气爬完全程，坐在梯子上脚都是发抖的，不敢在往下看，寻求刺激的可以试试，到了山顶感觉那些垂直的梯子都是小儿科了，如果不想走太多 ，建议北坐索道上，一路向西都是爬山，这样会好点，然后从西坐索道下，北峰到西峰估计2小时可以走完。,
vdx162248597,425,5,2021.12.02,华山风景名胜区票门票（徒步登山）,非常满意的一次,
真爱百年99,425,5,2021.11.09,华山风景名胜区西峰索道单程票,下了好大决心 跟老公登了华山 真的绝对不虚此行 虽然很累 但华山的险无山可敌 在山顶俯瞰脚下 真心太美了,
树袋熊0351,425,5,2021.10.04,华山风景名胜区票门票（徒步登山）,说说真实的感受。华山官网的攻略说徒步到北峰需要3小时左右，实际耗时约5小时。如果不是体力特别牛叉的，大家一定要多预留时间。苍龙岭的云海很漂亮，如果登山途中有雨，可以一睹风采。,
小仙女的美食团,425,3,2021.09.02,(地推）华山风景名胜区票+西峰摆渡车票（上行）+关帝庙景区票成人票,还可以吧，一个人坐索道着实吓死我了，去的时候爱晚亭正在整休。东上索道，南下旅游观光车。不过这个景区玩的一般，附近有一个花道寿司挺好吃的。,
阳光照射它脸上,425,5,2021.09.30,(地推)华山风景名胜区门票+北峰摆渡车+北峰单程索道+关帝庙成人票,一个字，险，华山不愧是五岳最险，下的腿软,
kaT673829840,425,3,2021.11.24,华山风景名胜区门票成人票,门票是真贵呀，风景也是真壮观呀,
OKf294010150,425,5,2021.09.11,华山风景名胜区（徒步登山）门票成人票,华山是第二次去了，依然觉得此生必去，美景无法用语言描述，手机拍不下华山的险奇，美哉！我大中华！,
匿名用户,425,5,2021.11.27,华山风景名胜区（徒步登山）门票成人票,去突破自我的时候就去华山,
aGn680347954,425,3,2021.11.23,华山风景名胜区-门票,挺好的，风景优美，景色迷人，大家可以去看看,
RTC759448511,425,2,2021.11.25,华山风景名胜区票门票（徒步登山）,去了下雨，一个人累得要死想哭？？？？？,
北风咧咧,425,5,2021.10.03,华山风景名胜区（徒步登山）门票成人票, ,
沈一帆666,425,5,2021.11.22,华山风景名胜区西峰索道单程票,很有挑战性，特别索道,
IJd649364916,425,3,2021.11.23,（上行）华山风景名胜区门票+单程西峰摆渡车票+单程西峰索道票,有机会再去登华山。。。。。。。。。。。。。,
QUE311575211,425,1,2021.11.13,华山风景名胜区（徒步登山）门票成人票,辣鸡地方，人民币都不收，手机没有网不行，自己想办法。就是不收现金。,
匿名用户,425,4,2021.08.13,华山风景名胜区（徒步登山）门票成人票, ,
CQA384372492,425,3,2021.11.21,华山风景名胜区（徒步登山）门票成人票,感觉还可以，爬山还可以………………,
娃哈哈45678,425,5,2021.09.29,华山风景名胜区（徒步登山）门票成人票,有的地方没有扶手和锁链，有点吓人啊，，，注意安全，慢慢爬,
一点尘埃105,425,3,2021.11.13,华山风景名胜区票门票（徒步登山）,第二天天气相当给力，太美了，很不错，是我三次登陆最美的一次。。。。。,
赵远胜啊,425,5,2021.11.10,华山风景名胜区学生门票+单程西峰进山车票,设施齐全，服务热情，环境也不错，交通便利，值得推荐,
梦游起来开路由,425,5,2021.08.15,华山风景名胜区西峰索道单程票,「华山西峰」「长空栈道」实在是来不及去东峰？看日出了其实哪里都可以看，视角不太一样罢了，路上看到有很小的小朋友来爬山的，大人爬下来都累的够呛了，小朋友真的很厉害。前面都有很多补给站，可以买水，泡面和其他的补给等。,
qingxuwei,425,5,2021.11.14,（经典玩法不走回头路）华山门票+单程西峰索道票+单程北峰索道票+单程北峰索道专线巴士票+单程西峰索道专线巴士票,值得推荐，团建好去处,
ycy911104,425,5,2021.11.10,华山风景名胜区（徒步登山）门票成人票,真的强烈推荐徒步上山这条路，风景那是极佳！,
匿名用户,425,1,2021.08.03,（地推）华山风景名胜区门票+西峰摆渡车+西峰单程索道+关帝庙成人票,工作人员态度恶劣，旅游体验差，门票160，缆车140，摆渡车40，还只是单程，一个人差不多要花到500，东西也是相当的贵，一瓶康师傅水15，一桶泡面35，，风景基本都差不太多，去一次绝对不会去第二次，进去孩子都不要票，身高不够120，下来坐缆车工作人员又让买票说身高超了，难不成爬个山我孩子就立马长高了几厘米吗？,
爱人不易i,425,5,2021.10.01,(地推）华山风景名胜区票+西峰摆渡车票（上行）+关帝庙景区票成人票,华山的险和陡名不虚传，但是真的好美,
岚舞曼山谷,425,4,2021.07.07,华山风景名胜区西峰单程索道票学生票,西安的夏天真的燥热，夜爬还好有小凉风，但是路上的风景就欣赏不到了。带女朋友去的，登上峰顶真的很累。晚上九点入园，慢慢爬带中途短时间休息，一点到北峰，四点半到达东峰，上去的时候天还黑，很冷，五40左右日出，腿上凉飕飕的，一定要多带衣服，外套厚裤子上到顶峰必不可少。当你到达金锁关的位置说明离东峰就不远了，日出在仙掌位置也可以看到，山顶人太多了，根本挤不到前面去拍。体力不是很好的不介意去爬，第二天脚很疼，爬之前一定要多休息补充能量，慢爬少休，一次休息的时间长了再走腿很吃力。还有千万记住厚衣服！,
